{
  "header" : {
    "countingValue" : "Time",
    "countingUnit" : "s",
    "channels" : [ {
      "binLimits" : [ -3.1535425E37 ],
      "channelName" : "TorqueInputshaft",
      "unit" : "Nm",
      "upperLimit" : 1500.0,
      "lowerLimit" : -500.0,
      "numberOfBins" : 10
    } ],
    "countingMethod" : "Rainflow"
  },
  "metadata" : {
    "projectDescription" : "\"projectnumber pqr12345\"",
    "componentDescription" : "gear set",
    "routeDescription" : "\"city munich heavy trailer\"",
    "status" : {
      "date" : "2023-10-25T14:22:35.223+02:00",
      "operatingHours" : 3456.2,
      "mileage" : 123456
    }
  },
  "targetComponentID" : "telnet://192.0.2.16:80/",
  "body" : {
    "counts" : {
      "countsName" : "Time",
      "countsList" : [ 7.9 ]
    },
    "classes" : [ {
      "classList" : [ 5 ],
      "className" : "Torque_Inputshaft-class"
    } ]
  },
  "residuum" : {
    "residuumClassName" : "Temp_Oil-class",
    "residuumList" : [ 6 ]
  }
}